<?xml version="1.0" encoding="UTF-8"?>
<!DOCTYPE eSummaryResult PUBLIC "-//NLM//DTD eSummaryResult//EN" "http://www.ncbi.nlm.nih.gov/entrez/query/DTD/eSummaryDTD/eSummary_genome.dtd">
<eSummaryResult>
<DocumentSummarySet status="OK">
<DocumentSummary uid="2640">
	<Organism_Name>Maylandia zebra</Organism_Name>
	<Organism_Kingdom>Eukaryotes</Organism_Kingdom>
	<Organism_Group></Organism_Group>
	<Organism_Subgroup>Fishes</Organism_Subgroup>
	<Defline>The zebra mbuna is a freshwater cichlid fish found in lakes in Malawi, Mozambique, and Tanzania.</Defline>
	<ProjectID>43325</ProjectID>
	<Project_Accession>PRJNA43325</Project_Accession>
	<Status>Draft</Status>
	<Number_of_Chromosomes>0</Number_of_Chromosomes>
	<Number_of_Plasmids>0</Number_of_Plasmids>
	<Number_of_Organelles>0</Number_of_Organelles>
	<Assembly_Name>MetZeb1.1</Assembly_Name>
	<Assembly_Accession>GCA_000238955.2</Assembly_Accession>
	<AssemblyID>398768</AssemblyID>
	<Create_Date>2010/01/01 00:00</Create_Date>
	<Options></Options>
	<Weight>0</Weight>
</DocumentSummary>

</DocumentSummarySet>
</eSummaryResult>
